{
  "$schema": "../../packages/portal-sdk/schema/novatlantis-app.schema.json",
  "appId": "justice-court-tj",
  "version": "1.0.0",
  "owner": "TJ",
  "sector": "JUDICIARY_STATE_COURT",
  "serviceUrlEnvVar": "JUSTICE_COURT_TJ_URL",
  "defaultPort": 8089,
  "landingCatalog": {
    "enabled": true,
    "icon": "Gavel",
    "badge": "Tribunal de Justiça",
    "title": {
      "pt-BR": "Tribunal de Justiça e Juizado Especial",
      "es-419": "Tribunal de Justicia y Juzgado Especial",
      "en-US": "Court of Justice & Small Claims"
    },
    "agency": {
      "pt-BR": "Poder Judiciário",
      "es-419": "Poder Judicial",
      "en-US": "Judiciary"
    },
    "description": {
      "pt-BR": "Consulta processual, emissão de certidão judicial (nada consta) e abertura de ações no Juizado Especial.",
      "es-419": "Consulta procesal, emisión de certificado judicial y apertura de demandas en el Juzgado Especial.",
      "en-US": "Case lookup, judicial clearance certificates, and small claims filing."
    },
    "questionPrompt": {
      "pt-BR": "Como consultar processos ou emitir certidão no Tribunal de Justiça?",
      "es-419": "¿Cómo consultar procesos o emitir certificado en el Tribunal de Justicia?",
      "en-US": "How do I check court cases or issue a clearance certificate?"
    },
    "servicePrompt": {
      "pt-BR": "Consultar processos e emitir certidão judicial",
      "es-419": "Consultar procesos y emitir certificado judicial",
      "en-US": "Check court cases and issue judicial certificate"
    }
  },
  "agentIntegration": {
    "agentId": "agent-justice-court-tj",
    "triggerKeywords": [
      "tribunal",
      "justiça",
      "justica",
      "processo",
      "processos",
      "juiz",
      "juizado",
      "processual",
      "sentença",
      "sentenca",
      "certidão judicial",
      "certidao judicial",
      "nada consta",
      "petição",
      "peticao",
      "conciliação",
      "conciliacao",
      "tj",
      "court",
      "lawsuit",
      "juzgado"
    ],
    "executeEndpoint": "/api/v1/agent/execute",
    "requiresAuthForTransaction": true
  },
  "citizenPortalTab": {
    "enabled": true,
    "tabId": "justice_court_tj",
    "title": {
      "pt-BR": "Tribunal de Justiça",
      "es-419": "Tribunal de Justicia",
      "en-US": "Court of Justice"
    },
    "subtitle": {
      "pt-BR": "Processos, certidões e Juizado Especial",
      "es-419": "Procesos, certificados y Juzgado Especial",
      "en-US": "Cases, certificates, and Small Claims"
    },
    "uiEntryPath": "/embed/citizen",
    "apiBasePath": "/api/v1/apps/justice-court-tj"
  },
  "backstageModule": {
    "enabled": true,
    "moduleId": "justice_court_tj_backstage",
    "allowedRoles": [
      "PRIME_MINISTER_ROOT",
      "SECRETARY_GENERAL",
      "JUSTICE_AND_TREASURY_MANAGER"
    ],
    "title": {
      "pt-BR": "Tribunal de Justiça",
      "es-419": "Tribunal de Justicia",
      "en-US": "Court of Justice"
    },
    "subtitle": {
      "pt-BR": "Fila processual e minutas de sentença",
      "es-419": "Cola procesal y minutas de sentencia",
      "en-US": "Case queue and draft decisions"
    },
    "uiEntryPath": "/embed/backstage"
  }
}
